Title,Authors,Year,Publication Link,Author Profile Links
Assessing the determinants of participation in the circular plastic economy by Nigerian students,"['Ajala, O.']",2 Jan 2025,https://pureportal.coventry.ac.uk/en/publications/assessing-the-determinants-of-participation-in-the-circular-plast-2,['https://pureportal.coventry.ac.uk/en/persons/olubunmi-ajala']
Does self-congruity matter for virtual influencer’s non-fungible token (NFT) purchase intentions? The role of financial literacy,"['Brahmana, R. K.']",14 Jan 2025,https://pureportal.coventry.ac.uk/en/publications/does-self-congruity-matter-for-virtual-influencers-non-fungible-t,['https://pureportal.coventry.ac.uk/en/persons/rayenda-khresna-brahmana']
Does the corporate governance index matter for company zombification?,"['Brahmana, R. K.']",22 Jan 2025,https://pureportal.coventry.ac.uk/en/publications/does-the-corporate-governance-index-matter-for-company-zombificat,['https://pureportal.coventry.ac.uk/en/persons/rayenda-khresna-brahmana']
Fostering Entrepreneurship and Innovation in Nigerian Universities,"['Ajala, O.']",Jan 2025,https://pureportal.coventry.ac.uk/en/publications/fostering-entrepreneurship-and-innovation-in-nigerian-universitie,['https://pureportal.coventry.ac.uk/en/persons/olubunmi-ajala']
"Managerial Regulatory Engagement, Access to Bank Finance, and the Moderating Role of Institutional Religiosity: A Cross-country Study","['Aghanya, D.']",Jan 2025,https://pureportal.coventry.ac.uk/en/publications/managerial-regulatory-engagement-access-to-bank-finance-and-the-m,['https://pureportal.coventry.ac.uk/en/persons/daniel-aghanya']
Mechanic Village Business Networks and Circular Economy Practices in the Automotive Industry,"['Ajala, O.']",17 Jan 2025,https://pureportal.coventry.ac.uk/en/publications/mechanic-village-business-networks-and-circular-economy-practices,['https://pureportal.coventry.ac.uk/en/persons/olubunmi-ajala']
Popular movie effects on advanced finance course performance: flipped classroom vs in-class view,"['Brahmana, R. K.']",17 Jan 2025,https://pureportal.coventry.ac.uk/en/publications/popular-movie-effects-on-advanced-finance-course-performance-flip,['https://pureportal.coventry.ac.uk/en/persons/rayenda-khresna-brahmana']
Success in cross-border M&A deals: Can ESG performance be a countervailing force against political risk?,"['Xu, B.', 'Mulatu, A.']",10 Feb 2025,https://pureportal.coventry.ac.uk/en/publications/success-in-cross-border-mampa-deals-can-esg-performance-be-a-coun,"['https://pureportal.coventry.ac.uk/en/persons/boying-xu', 'https://pureportal.coventry.ac.uk/en/persons/abay-mulatu']"
What makes companies zombie? Detecting the most important zombification feature using tree-based machine learning,"['Brahmana, R. K.']",25 Apr 2025,https://pureportal.coventry.ac.uk/en/publications/what-makes-companies-zombie-detecting-the-most-important-zombific,['https://pureportal.coventry.ac.uk/en/persons/rayenda-khresna-brahmana']
Whether voluntary GHG disclosure could help improve subsequent GHG performance-new global evidence,"['Li, M.']",Jan 2025,https://pureportal.coventry.ac.uk/en/publications/whether-voluntary-ghg-disclosure-could-help-improve-subsequent-gh,['https://pureportal.coventry.ac.uk/en/persons/mingchen-li']
Accounting professionals’ legitimacy maintenance of modern slavery inspired extreme work practices in an emerging economy,"['Chhatbar, M.']",23 Feb 2024,https://pureportal.coventry.ac.uk/en/publications/accounting-professionals-legitimacy-maintenance-of-modern-slavery,['https://pureportal.coventry.ac.uk/en/persons/mehul-chhatbar']
A risk–return trade‐off or co‐movement? Are food processing firms risk‐averse?,"['Usman, A.']",7 Apr 2024,https://pureportal.coventry.ac.uk/en/publications/a-riskreturn-tradeoff-or-comovement-are-food-processing-firms-ris,['https://pureportal.coventry.ac.uk/en/persons/ahmed-usman']
Assessing the implementation of Santiago Principles by Sovereign Wealth Funds in the ASEAN Community,"['Rwakigumba, R.', 'Guney, Y.', 'Lauretta, E.']",10 Sept 2024,https://pureportal.coventry.ac.uk/en/publications/assessing-the-implementation-of-santiago-principles-by-sovereign-,"['https://pureportal.coventry.ac.uk/en/persons/ronald-rwakigumba', 'https://pureportal.coventry.ac.uk/en/persons/yilmaz-guney', 'https://pureportal.coventry.ac.uk/en/persons/eliana-lauretta']"
Beyond Profit: The Humanisation of Economics Through the Theory of Equitable Optimality,"['Alamad, S.']",13 Apr 2024,https://pureportal.coventry.ac.uk/en/publications/beyond-profit-the-humanisation-of-economics-through-the-theory-of,['https://pureportal.coventry.ac.uk/en/persons/samir-alamad']
Catalysing Environmental Action: a Governance Framework for Enhancing Individual Participation in Sub-Saharan Africa’s Plastic Circular Economy,"['Ajala, O.']",17 Sept 2024,https://pureportal.coventry.ac.uk/en/publications/catalysing-environmental-action-a-governance-framework-for-enhanc,['https://pureportal.coventry.ac.uk/en/persons/olubunmi-ajala']
CEO succession origin and annual reports readability,"['E-Vahdati, S.']",Nov 2024,https://pureportal.coventry.ac.uk/en/publications/ceo-succession-origin-and-annual-reports-readability,['https://pureportal.coventry.ac.uk/en/persons/sahar-e-vahdati']
Contextualised accountant stereotypes: understanding their social construction and reconstruction in Chinese society,[],4 Jan 2024,https://pureportal.coventry.ac.uk/en/publications/contextualised-accountant-stereotypes-understanding-their-social-,[]
Corporate Financial Hedging and the Cost of Equity Capital,"['Ahmed, H. B.', 'Guney, Y.']",9 Jun 2024,https://pureportal.coventry.ac.uk/en/publications/corporate-financial-hedging-and-the-cost-of-equity-capital-2,"['https://pureportal.coventry.ac.uk/en/persons/hany-ahmed', 'https://pureportal.coventry.ac.uk/en/persons/yilmaz-guney']"
Corporate governance and cost of equity: the moderating role of ownership concentration levels,"['Brahmana, R. K.']",21 May 2024,https://pureportal.coventry.ac.uk/en/publications/corporate-governance-and-cost-of-equity-the-moderating-role-of-ow,['https://pureportal.coventry.ac.uk/en/persons/rayenda-khresna-brahmana']
"Diffusion theory, economic consequences, and adoption of international standards on auditing around the world","['Elmghaamez, I.']",Sept 2024,https://pureportal.coventry.ac.uk/en/publications/diffusion-theory-economic-consequences-and-adoption-of-internatio,['https://pureportal.coventry.ac.uk/en/persons/ibrahim-elmghaamez']
Digitally enabled business models for a circular plastic economy in Africa,"['Ajala, O.']",Aug 2024,https://pureportal.coventry.ac.uk/en/publications/digitally-enabled-business-models-for-a-circular-plastic-economy-,['https://pureportal.coventry.ac.uk/en/persons/olubunmi-ajala']
Does board–CEO age similarity affect earnings management? An empirical analysis from M&A contexts,"['Nguyen, T.', 'Nguyen, T.', 'Alhaj Ismail, A.']",6 Aug 2024,https://pureportal.coventry.ac.uk/en/publications/does-boardceo-age-similarity-affect-earnings-management-an-empiri,"['https://pureportal.coventry.ac.uk/en/persons/thang-nguyen', 'https://pureportal.coventry.ac.uk/en/persons/thai-nguyen', 'https://pureportal.coventry.ac.uk/en/persons/alaa-alhaj-ismail']"
Does Digital Orientation Enhance Firm Performance?,"['Brahmana, R. K.']",22 Aug 2024,https://pureportal.coventry.ac.uk/en/publications/does-digital-orientation-enhance-firm-performance,['https://pureportal.coventry.ac.uk/en/persons/rayenda-khresna-brahmana']
Does digital transformation matter for international diversification? The role of product market competition,"['Brahmana, R. K.']",24 Dec 2024,https://pureportal.coventry.ac.uk/en/publications/does-digital-transformation-matter-for-international-diversificat,['https://pureportal.coventry.ac.uk/en/persons/rayenda-khresna-brahmana']
Does information seeking moderate the relationship between financial loan inclusion and Fintech P2P lending?,"['Brahmana, R. K.']",Mar 2024,https://pureportal.coventry.ac.uk/en/publications/does-information-seeking-moderate-the-relationship-between-financ,['https://pureportal.coventry.ac.uk/en/persons/rayenda-khresna-brahmana']
Does product market competition affect corporate waste management? International evidence,"['Hossain, Z.']",Sept 2024,https://pureportal.coventry.ac.uk/en/publications/does-product-market-competition-affect-corporate-waste-management,['https://pureportal.coventry.ac.uk/en/persons/zakir-hossain']
Does R&D investment drive employment growth? Empirical evidence at industry level from Japan,"['Lee, P. Y.']",Jan 2024,https://pureportal.coventry.ac.uk/en/publications/does-rampd-investment-drive-employment-growth-empirical-evidence-,['https://pureportal.coventry.ac.uk/en/persons/pakyee-lee']
Does sharia-compliant debt financing reduce stock price crash risk?,"['Brahmana, R. K.']",21 Feb 2024,https://pureportal.coventry.ac.uk/en/publications/does-sharia-compliant-debt-financing-reduce-stock-price-crash-ris,['https://pureportal.coventry.ac.uk/en/persons/rayenda-khresna-brahmana']
Does the CEO effect differ in times of crisis? Evidence from US and China during the global financial crisis,"['Yu, M.']",Sept 2024,https://pureportal.coventry.ac.uk/en/publications/does-the-ceo-effect-differ-in-times-of-crisis-evidence-from-us-an,['https://pureportal.coventry.ac.uk/en/persons/mei-yu']
EDITORIAL: Participatory corporate governance for sustainability and accountability,"['Alsaid, L.']",21 May 2024,https://pureportal.coventry.ac.uk/en/publications/editorial-participatory-corporate-governance-for-sustainability-a,['https://pureportal.coventry.ac.uk/en/persons/loai-alsaid']
Embedding stakeholder engagement in sustainability reporting: A 6-step cycle,"['Tiong, P. N. C.']",10 Apr 2024,https://pureportal.coventry.ac.uk/en/publications/embedding-stakeholder-engagement-in-sustainability-reporting-a-6-,['https://pureportal.coventry.ac.uk/en/persons/paul-tiong']
"Entrepreneurship and innovation in Nigerian universities: Trends, challenges and opportunities","['Ajala, O.']",15 May 2024,https://pureportal.coventry.ac.uk/en/publications/entrepreneurship-and-innovation-in-nigerian-universities-trends-c,['https://pureportal.coventry.ac.uk/en/persons/olubunmi-ajala']
Environmental and social accountability in emerging economies: strategic pressures from and responses to vulnerable local communities,"['Noah, A. O.']",30 May 2024,https://pureportal.coventry.ac.uk/en/publications/environmental-and-social-accountability-in-emerging-economies-str,['https://pureportal.coventry.ac.uk/en/persons/abdurafiu-noah']
ESG disclosure and financial performance of multinational enterprises: The moderating effect of board standing committees,"['Elmghaamez, I.']",Jul 2024,https://pureportal.coventry.ac.uk/en/publications/esg-disclosure-and-financial-performance-of-multinational-enterpr,['https://pureportal.coventry.ac.uk/en/persons/ibrahim-elmghaamez']
ESG performance and financial distress during COVID-19: the moderating effects of innovation and capital intensity,"['E-Vahdati, S.']",19 Sept 2024,https://pureportal.coventry.ac.uk/en/publications/esg-performance-and-financial-distress-during-covid-19-the-modera,['https://pureportal.coventry.ac.uk/en/persons/sahar-e-vahdati']
Evaluating Drivers of Fintech Adoption in the Netherlands,"['Hasan, R.']",Dec 2024,https://pureportal.coventry.ac.uk/en/publications/evaluating-drivers-of-fintech-adoption-in-the-netherlands,['https://pureportal.coventry.ac.uk/en/persons/rashedul-hasan']
Exploring the Efficacy of Ecolabels as a Marketing Strategy: Insights from the Emerging Bioplastic Packaging Market,"['Baskoro, M. L.', 'Tjahjono, B.', 'Bogush, A.', 'Brahmana, R. K.']",Nov 2024,https://pureportal.coventry.ac.uk/en/publications/exploring-the-efficacy-of-ecolabels-as-a-marketing-strategy-insig,"['https://pureportal.coventry.ac.uk/en/persons/muhammad-lahandi-baskoro', 'https://pureportal.coventry.ac.uk/en/persons/benny-tjahjono', 'https://pureportal.coventry.ac.uk/en/persons/anna-bogush', 'https://pureportal.coventry.ac.uk/en/persons/rayenda-khresna-brahmana']"
"External arms embargoes and their implications for government expenditure, democracy and internal conflict","['Dizaji, S. F.']",1 Jan 2024,https://pureportal.coventry.ac.uk/en/publications/external-arms-embargoes-and-their-implications-for-government-exp,['https://pureportal.coventry.ac.uk/en/persons/sajjad-faraji-dizaji']
Female political empowerment and green finance,"['Hossain, Z.']",Mar 2024,https://pureportal.coventry.ac.uk/en/publications/female-political-empowerment-and-green-finance,['https://pureportal.coventry.ac.uk/en/persons/zakir-hossain']
Fiscal Consolidation and Firm Growth in Developing Countries: Evidence from Firm-level Data,"['Pahula, H.', 'Tanna, S.', 'De Vita, G.']",Jan 2024,https://pureportal.coventry.ac.uk/en/publications/fiscal-consolidation-and-firm-growth-in-developing-countries-evid,"['https://pureportal.coventry.ac.uk/en/persons/hildebrando-pahula-2', 'https://pureportal.coventry.ac.uk/en/persons/sailesh-tanna', 'https://pureportal.coventry.ac.uk/en/persons/glauco-de-vita']"
Fostering trust and overcoming psychological resistance towards cryptocurrencies and cryptoassets,"['Babu, M. M.', 'Bason, T.', 'Petratos, P.']",Jan 2024,https://pureportal.coventry.ac.uk/en/publications/fostering-trust-and-overcoming-psychological-resistance-towards-c,"['https://pureportal.coventry.ac.uk/en/persons/mujahid-mohiuddin-babu', 'https://pureportal.coventry.ac.uk/en/persons/tom-bason', 'https://pureportal.coventry.ac.uk/en/persons/pythagoras-petratos']"
Government Ownership and the Public Information Content of Insider Trading: International Evidence,"['Hossain, Z.']",21 Mar 2024,https://pureportal.coventry.ac.uk/en/publications/government-ownership-and-the-public-information-content-of-inside,['https://pureportal.coventry.ac.uk/en/persons/zakir-hossain']
How consistent are measures of financial liberalization in assessing its impact on bank cost efficiency? A cross–country empirical analysis,"['De Vita, G.', 'Tanna, S.']",1 Nov 2024,https://pureportal.coventry.ac.uk/en/publications/how-consistent-are-measures-of-financial-liberalization-in-assess,"['https://pureportal.coventry.ac.uk/en/persons/glauco-de-vita', 'https://pureportal.coventry.ac.uk/en/persons/sailesh-tanna']"
Impact of attention on rare events across industries in Indonesia,"['Khresna Brahmana, R.']",12 Apr 2024,https://pureportal.coventry.ac.uk/en/publications/impact-of-attention-on-rare-events-across-industries-in-indonesia,['https://pureportal.coventry.ac.uk/en/persons/rayenda-khresna-brahmana']
"Insider trading, gender diversity within the board room, CEO pay gap, and stock price crash risk","['Le, V. P.']",Apr 2024,https://pureportal.coventry.ac.uk/en/publications/insider-trading-gender-diversity-within-the-board-room-ceo-pay-ga,['https://pureportal.coventry.ac.uk/en/persons/viet-le']
Insider Trading and CEO Pay-Gap Induced Turnover,"['Le, V.']",27 Oct 2024,https://pureportal.coventry.ac.uk/en/publications/insider-trading-and-ceo-pay-gap-induced-turnover,['https://pureportal.coventry.ac.uk/en/persons/viet-le']
Insider Trading before Earnings News: The Role of Executive Pay Disparity,"['Le, V.']",6 Oct 2024,https://pureportal.coventry.ac.uk/en/publications/insider-trading-before-earnings-news-the-role-of-executive-pay-di,['https://pureportal.coventry.ac.uk/en/persons/viet-le']
"National culture, religiosity, and audited financial statements of small-scale MNCs","['Brahmana, R. K.']",30 May 2024,https://pureportal.coventry.ac.uk/en/publications/national-culture-religiosity-and-audited-financial-statements-of-,['https://pureportal.coventry.ac.uk/en/persons/rayenda-khresna-brahmana']
Performance measurement in urban development: unfolding a case of sustainability KPIs reporting,"['Alsaid, L.']",9 Feb 2024,https://pureportal.coventry.ac.uk/en/publications/performance-measurement-in-urban-development-unfolding-a-case-of-,['https://pureportal.coventry.ac.uk/en/persons/loai-alsaid']
Performance of shariah-compliant and non-shariah-compliant ETFs: a comparative study,"['Hasan, R.']",30 Sept 2024,https://pureportal.coventry.ac.uk/en/publications/performance-of-shariah-compliant-and-non-shariah-compliant-etfs-a,['https://pureportal.coventry.ac.uk/en/persons/rashedul-hasan']
Students’ development of employability skills through an online international hackathon,"['Bello, J.']",22 May 2024,https://pureportal.coventry.ac.uk/en/publications/students-development-of-employability-skills-through-an-online-in,['https://pureportal.coventry.ac.uk/en/persons/jaliyyah-bello']
Sustainability Management Accounting in Urban Development: A Case Study of an Egyptian State-Owned Enterprise,"['Alsaid, L.']",22 Sept 2024,https://pureportal.coventry.ac.uk/en/publications/sustainability-management-accounting-in-urban-development-a-case-,['https://pureportal.coventry.ac.uk/en/persons/loai-alsaid']
The cyclicality of the finance premium over the business cycle,"['Kalubowila, C. D.']",15 Nov 2024,https://pureportal.coventry.ac.uk/en/publications/the-cyclicality-of-the-finance-premium-over-the-business-cycle,['https://pureportal.coventry.ac.uk/en/persons/chashika-dilhara-kalubowila']
"The Finance Growth Nexus, Institutions Matter: Evidence from The A10 Countries of The Eu","['Udeogu, E.']",10 Dec 2024,https://pureportal.coventry.ac.uk/en/publications/the-finance-growth-nexus-institutions-matter-evidence-from-the-a1,['https://pureportal.coventry.ac.uk/en/persons/ejike-udeogu']
The global financial crisis impact on stock market efficiency: a Fourier unit root tests analysis,"['E-Vahdati, S.']",1 Sept 2024,https://pureportal.coventry.ac.uk/en/publications/the-global-financial-crisis-impact-on-stock-market-efficiency-a-f,['https://pureportal.coventry.ac.uk/en/persons/sahar-e-vahdati']
"The Impact of Maoism on the Architectural Vocabulary, Urban Form and Structure in the Cities of China","['Huston, S.']",25 Jun 2024,https://pureportal.coventry.ac.uk/en/publications/the-impact-of-maoism-on-the-architectural-vocabulary-urban-form-a,['https://pureportal.coventry.ac.uk/en/persons/simon-huston']
"The impact of the global financial crisis and the European sovereign debt crisis on the capital structure of firms in Europe: Do SMEs, and listed firms respond the same?","['Bvirindi, T.']",23 May 2024,https://pureportal.coventry.ac.uk/en/publications/the-impact-of-the-global-financial-crisis-and-the-european-sovere,['https://pureportal.coventry.ac.uk/en/persons/tinashe-bvirindi']
The Influence of Job Stress on Organizational Commitment Among Workers in the Palm Oil Industry: Does Job Satisfaction Matter?,"['E-Vahdati, S.']",31 May 2024,https://pureportal.coventry.ac.uk/en/publications/the-influence-of-job-stress-on-organizational-commitment-among-wo,['https://pureportal.coventry.ac.uk/en/persons/sahar-e-vahdati']
The interaction effect of board characteristics and ESG reporting on the financial performance of multinational enterprises: a quantile regression approach,"['Elmghaamez, I.']",8 May 2024,https://pureportal.coventry.ac.uk/en/publications/the-interaction-effect-of-board-characteristics-and-esg-reporting,['https://pureportal.coventry.ac.uk/en/persons/ibrahim-elmghaamez']
Triple-Entry Accounting and System Integration,"['Petratos, P.']",25 Jan 2024,https://pureportal.coventry.ac.uk/en/publications/triple-entry-accounting-and-system-integration,['https://pureportal.coventry.ac.uk/en/persons/pythagoras-petratos']
Vulnerability of a developing stock market to openness: one-way return and volatility transmissions,"['Ibrahim, M.']",May 2024,https://pureportal.coventry.ac.uk/en/publications/vulnerability-of-a-developing-stock-market-to-openness-one-way-re,['https://pureportal.coventry.ac.uk/en/persons/masud-ibrahim']
ABC as a multi-lens sustainability reporting system in smart cities,"['Alsaid, L.']",9 Jun 2023,https://pureportal.coventry.ac.uk/en/publications/abc-as-a-multi-lens-sustainability-reporting-system-in-smart-citi,['https://pureportal.coventry.ac.uk/en/persons/loai-alsaid']
Assessing Plastic Circular Economy Policies and the Use of Digital Technology in Africa,"['Ajala, O.']",31 May 2023,https://pureportal.coventry.ac.uk/en/publications/assessing-plastic-circular-economy-policies-and-the-use-of-digita,['https://pureportal.coventry.ac.uk/en/persons/olubunmi-ajala']
Assessing the Determinants of Participation in the Circular Plastic Economy by Nigerian Students,"['Ajala, O.']",27 Apr 2023,https://pureportal.coventry.ac.uk/en/publications/assessing-the-determinants-of-participation-in-the-circular-plast,['https://pureportal.coventry.ac.uk/en/persons/olubunmi-ajala']
Assessing the Use of Gold as a Zero-Beta Asset in Empirical Asset Pricing: Application to the US Equity Market,[],15 Mar 2023,https://pureportal.coventry.ac.uk/en/publications/assessing-the-use-of-gold-as-a-zero-beta-asset-in-empirical-asset,[]
Audit Committee and Dividend Policy of Financial Firms in Malaysia,"['Hasan, R.']",7 Dec 2023,https://pureportal.coventry.ac.uk/en/publications/audit-committee-and-dividend-policy-of-financial-firms-in-malaysi,['https://pureportal.coventry.ac.uk/en/persons/rashedul-hasan']
Ayondo Ltd. Corporate Governance Issues of First FinTech Company Listed on the Catalist Board of Singapore Exchange,"['Tiong, P. N. C.']",7 Dec 2023,https://pureportal.coventry.ac.uk/en/publications/ayondo-ltd-corporate-governance-issues-of-first-fintech-company-l,['https://pureportal.coventry.ac.uk/en/persons/paul-tiong']
Bank stock valuation theories: do they explain prices based on theories?,[],28 Mar 2023,https://pureportal.coventry.ac.uk/en/publications/bank-stock-valuation-theories-do-they-explain-prices-based-on-the,[]
Benefits on the Margin from Public Spending across Healthcare Levels and Geopolitical Zones in Nigeria,"['Udeogu, E.']",Oct 2023,https://pureportal.coventry.ac.uk/en/publications/benefits-on-the-margin-from-public-spending-across-healthcare-lev,['https://pureportal.coventry.ac.uk/en/persons/ejike-udeogu']
Cash Holdings and R&D Intensity with Different Controlling Shareholders,"['Brahmana, R. K.']",24 Jan 2023,https://pureportal.coventry.ac.uk/en/publications/cash-holdings-and-rampd-intensity-with-different-controlling-shar,['https://pureportal.coventry.ac.uk/en/persons/rayenda-khresna-brahmana']
CEO Duality and Firm Performance: A Systematic Review and Research Agenda,"['Yu, M.']",1 Jun 2023,https://pureportal.coventry.ac.uk/en/publications/ceo-duality-and-firm-performance-a-systematic-review-and-research,['https://pureportal.coventry.ac.uk/en/persons/mei-yu']
Competing Institutional Logics and Power Dynamics in Islamic Financial Reporting Standardisation Projects,[],10 Jan 2023,https://pureportal.coventry.ac.uk/en/publications/competing-institutional-logics-and-power-dynamics-in-islamic-fina,[]
Conceptualising Accounting as a Value-Based Concept in the Context of Alternative Finance,"['Alamad, S.']",29 Dec 2023,https://pureportal.coventry.ac.uk/en/publications/conceptualising-accounting-as-a-value-based-concept-in-the-contex,['https://pureportal.coventry.ac.uk/en/persons/samir-alamad']
"Corporate Governance and Financial Performance of Firms Listed on Asian Pacific Stocks: Evidence from Malaysia, Thailand, and Singapore","['Elmghaamez, I.']",9 Mar 2023,https://pureportal.coventry.ac.uk/en/publications/corporate-governance-and-financial-performance-of-firms-listed-on,['https://pureportal.coventry.ac.uk/en/persons/ibrahim-elmghaamez']
Corporate Political Activity and Bribery in Africa: Do Internet Penetration and Foreign Ownership Matter?,"['Aghanya, D.']",Jan 2023,https://pureportal.coventry.ac.uk/en/publications/corporate-political-activity-and-bribery-in-africa-do-internet-pe,['https://pureportal.coventry.ac.uk/en/persons/daniel-aghanya']
"Corporate Sustainability Orientation, Sustainable Development Practices, and Firm Performance of MSMEs in Malaysia","['E-Vahdati, S.']",2023,https://pureportal.coventry.ac.uk/en/publications/corporate-sustainability-orientation-sustainable-development-prac,['https://pureportal.coventry.ac.uk/en/persons/sahar-e-vahdati']
Determinants of Digital Innovation in Micro and Small Industries,"['Brahmana, R. K.']",20 Jun 2023,https://pureportal.coventry.ac.uk/en/publications/determinants-of-digital-innovation-in-micro-and-small-industries,['https://pureportal.coventry.ac.uk/en/persons/rayenda-khresna-brahmana']
Do board characteristics moderate the relationship between political connections and cash holdings? insight from Asian countries,"['Brahmana, R. K.']",21 Dec 2023,https://pureportal.coventry.ac.uk/en/publications/do-board-characteristics-moderate-the-relationship-between-politi,['https://pureportal.coventry.ac.uk/en/persons/rayenda-khresna-brahmana']
Does natural resource curse in finance exist in Africa? Evidence from spatial techniques,"['Egbulonu, A.']",Jan 2023,https://pureportal.coventry.ac.uk/en/publications/does-natural-resource-curse-in-finance-exist-in-africa-evidence-f,['https://pureportal.coventry.ac.uk/en/persons/alloysius-egbulonu']
Does shared tenure between audit committee chair and engagement partner affect audit outcomes? Evidence from the UK,"['Alhaj Ismail, A.']",Mar 2023,https://pureportal.coventry.ac.uk/en/publications/does-shared-tenure-between-audit-committee-chair-and-engagement-p,['https://pureportal.coventry.ac.uk/en/persons/alaa-alhaj-ismail']
Do insider investment horizons contain information? Evidence from Australia,"['Hossain, Z.']",Jun 2023,https://pureportal.coventry.ac.uk/en/publications/do-insider-investment-horizons-contain-information-evidence-from-,['https://pureportal.coventry.ac.uk/en/persons/zakir-hossain']
Evaluating the failure of British Home Stores (BHS): A case study using Taffler Z-score model and SWOT analysis,"['Elmghaamez, I.']",3 Apr 2023,https://pureportal.coventry.ac.uk/en/publications/evaluating-the-failure-of-british-home-stores-bhs-a-case-study-us,['https://pureportal.coventry.ac.uk/en/persons/ibrahim-elmghaamez']
